功效,组成,适应证,按语,方源,制作,药名,编号,分类
养心安神，润肠通便。,炒柏子仁15g。,血虚不能养心所致的失眠多梦、心悸，老年及产后血虚、肠燥、便秘等病证。,柏子仁味甘性平，归心、肾、大肠经，可养心安神、润肠通便，用于虚烦不眠、心悸怔忡、肠燥便秘等。《本草纲目》谓柏子仁“性平而不寒不燥，味甘而补，辛而能润，其气清香，透心肾，益脾胃，功能养心气，润肾燥，安魂定魄，益智宁神，宜乎滋养之剂用之。”《本草正》记载:“柏子仁，气味清香，性多润滑，虽滋阴养血之佳剂，若欲培补根本，乃非清品之所长。”由于心主神明，肾司二便，柏子仁养心，所以柏子仁冲泡代茶饮安神益智，滋肾所以润肠通便。本品含脂肪油及少量挥发油、皂苷，故肠滑作泻者、痰多胃弱者及暑湿作泻者，均不宜服。,《气功药饵疗法与救治偏差手术》。,先将柏子仁拣净杂质，除去残留的外壳和种皮，轻轻捣碎。每次用10~15g，放入茶杯中，沸水冲泡代茶饮。,柏子仁茶,668,内科-心悸
提神清心，清热解暑，消食化痰，去腻减肥，清心除烦，解毒醒酒，生津止渴和抗衰老。,绿茶。,肥胖，高脂血症等。,绿茶味微苦，性寒，有提神清心、清热解暑、消食化痰、去腻减肥的功效。绿茶还有抗衰老、抗病毒、抗氧化、清除自由基、防治心血管疾病、美容护肤、降脂助消化等作用。绿茶之所以具有这些保健功能，主要是因为茶叶中的多酚类物质。如果冲泡温度过高或时间过久，多酚类物质就会被破坏，茶汤不但会变黄，其中的芳香物质也会挥发散失。一般来说，绿茶冲泡水温以80°C为宜，水初沸即可。冲泡时间以2~3分钟为好，最好现泡现饮。绿茶与水的比例要恰当，以1:50为宜，常用3g茶叶冲水150ml，冲泡出来的绿茶汤浓淡适中。本茶可日常频饮，不拘时温服。注意:绿茶不适宜于发热、肾功能不全、心血管疾病、习惯性便秘、消化道溃疡、神经衰弱、失眠患者与孕妇、哺乳期妇女、儿童饮用。,《食疗本草》。,将绿茶放入杯中，用沸水冲泡即成。,绿茶单方,669,内科-高脂血症
消食化积，活血散瘀。,山楂叶（花）5g。,高血压，高脂血症。,山楂叶，味酸性平。治疗漆疮、溃疡不敛、高血压。本方代茶温服，每日3~4次，不拘时饮。,经验方。,山楂叶（花）洗净，切碎，晒干，放入杯中，用适量沸水冲泡片刻即成。,山楂叶（花）茶,670,内科-高脂血症
降脂，化浊，利尿。,山楂根、茶树根、荠菜花、玉米须各10g。,高脂血症和肥胖等。,《分类草药性》称，山楂根能“消中膈之气，去肉积”，茶树根、荠菜花、玉米须则有降脂化湿、利尿渗湿之功，相为配伍，功效尤显。本方有利尿、降脂作用，故用于防治动脉硬化有一定疗效。动脉硬化根据其发病的部位分为粥样硬化（发生在比较粗的动脉中）、中膜硬化（中等大小的动脉及主动脉中）、微动脉硬化（多发生在脑、肾等细微动脉中）三种。其发病原因，粥样动脉硬化多由于饮食不科学，造成血中脂质尤其是胆固醇和中性脂肪增高，形成高脂血症而引起的；促进中膜硬化的因子是吸烟和高血压；微动脉硬化主要和高血压有关。本方代茶温饮，不拘时常服。,经验方。,先将山楂根、茶树根洗净，制成粗末，加荠菜花和切碎的玉米须后，共同放入砂锅中，加入适量水后文火慢煎，再取汁即成。,山楂根茶,671,内科-高脂血症
清肝明目，利水通便。,决明子5~10g，绿茶1~1.5g，冰糖25g。,高血压，高脂血症，大便秘结，视物模糊等。,《本草经疏》云:“决明子，其味咸平，《本草别录》益以苦甘微寒而无毒。咸得水气，甘得土气，苦可泄热，平合胃气，寒能益阴泄热，足厥阴肝家正药也。亦入胆肾。肝开窍于目，瞳子神光属肾，故主青盲目淫，肤赤白膜，眼赤痛泪出。”本方代茶温饮，不拘时常服。决明子茶苦寒伤胃，因此，脾胃虚寒、气血不足者不宜服。,经验方。,决明子5~10g，用文火炒至鼓起，呈黄褐色。配绿茶1~1.5g，冰糖25g，放入杯中，一起用开水冲泡即成。,绿茶决明子汤,672,内科-高脂血症
清热通淋，利尿消胀。,海金沙30g，腊面茶15g，生姜2片，甘草5g。,小便不通、脐下满闷等淋证。,海金沙性寒，味甘，归膀胱、小肠经，具有清利湿热、通淋止痛的作用，用于热淋、砂淋、血淋、膏淋、尿道涩痛。现代实验表明海金沙有消炎利胆、促进排石作用。《本草纲目》记载海金沙:“治湿热肿满，小便热淋、膏淋、血淋、石淋，茎痛，解热毒气。”腊面茶产自武夷山四曲御茶园，属武夷茶，其品质独特。经有关专家验证其具有提高免疫力、抗衰老、防癌、防治心血管疾病和保护泌尿器官等作用。生姜性温，茶中放2片是防茶寒凉太过伤正。本方每日2~3次，代茶温饮，可通淋利尿、善治诸淋。阴虚内热者及热盛之病证患者忌用。,《本草图经》。,将海金沙、腊面茶两味捣研细末，备用。每次取上末9g，与生姜、甘草一同加水煎汤即成。,金沙腊面茶,673,内科-尿路感染
息风通淋。,石韦根50g。,老年人阴虚内热炽盛所致的虚风内动，手足震颤等。,石韦根即水龙骨科植物石韦等多种同属植物的根茎。其作用与石韦相同。《滇南本草》谓其“消胸膈横气作胀，退蒸热”。每日1剂，代茶频服，久服必有一定效果。,《滇南本草》。,石韦根洗净，切碎，水煎取汁。,石韦根茶,674,内科-尿路感染
燥湿化毒祛风。,威灵仙5g，白芷3g，花茶3g。,尿路感染，腰痛。,威灵仙味辛、咸，性温。性善走，能通经络，祛风湿、止痛作用较强。风湿痹痛，肢体麻木，筋脉拘挛，关节屈伸不利者，均可应用。《广西中草药》谓其:“祛风除湿，通经活络，利尿，止痛。治风湿骨痛，黄疸，水肿，小便不利，偏头痛，跌打内伤。”白芷味辛性温，归肺、胃经，能祛风散寒、通窍止痛、消肿排脓、燥湿止带。现代医学研究表明，白芷具有抗炎、解热镇痛、解痉、抗菌、抗癌、抗辐射等作用。此方代茶频饮，不拘时温服。气虚血热、阴虚阳亢者禁服。,经验方。,将上三味药共同洗净切细，放入壶中，以沸水250ml浸泡片刻即成。,威灵芷茶,675,内科-尿路感染
清热利湿，凉血止血。,人字草60g。,血尿。,人字草味甘淡，性微凉，无毒，入肺、肾经。内服清热利湿、健脾、清肺利尿，主治咳嗽胸痛、暑热口渴、小儿疳积、久痢、疟疾、中暑发痧、伤暑小便不利、尿血、急性胃肠炎、夜盲症。本方代茶温饮，不拘时常服。注意：阴虚者不宜饮用。,经验方。,人字草，大多是生长在阴凉潮湿的山坡、田野、路边，一年之中除冬季外，其他三季都易采。将人字草洗净晒干，制成粗末，用沸水冲泡即成。,人字草茶,676,内科-尿路感染
健脾利湿，利尿通淋。,玉米芯60g。,乳糜尿，盗汗。,玉米芯，能健脾利湿、利尿。本方代茶温饮，不拘时常服。,经验方。,将玉米芯洗净，制成粗末，放入杯中，用沸水冲泡片刻即成。,玉米芯茶,677,内科-尿路感染
清热，凉血，止带。,凤眼草30g。,血淋。,凤眼草，味苦、涩，性凉，清热燥湿、止痢、止血，主治痢疾、白浊、带下、便血、尿血、崩漏。《嘉祐本草》谓其可用于治“大便下血”。《药材资料汇编》:“治肠风便血，小便下血，疗骨鲠。”本方代茶温饮，不拘时常服。,经验方。,凤眼草，8—9月果熟时采收，除去果柄，晒干。制成粗末，放入杯中，用沸水冲泡片刻即成。,凤眼草茶,678,内科-尿路感染
清热利尿，凉血止血。,旱莲草（墨旱莲）、车前草各20g，适量白糖。,血精，血尿等。,旱莲草，凉血止血、补肾益阴。治吐血、咯血、衄血、尿血、便血、血痢、刀伤出血、须发早白、白喉、淋浊、带下、阴部湿痒。；《唐本草》谓其:“主血痢。针灸疮发，洪血不可止者敷之；汁涂发眉，生速而繁。”车前草，清热利尿、凉血解毒。主热结膀胱，小便不利，淋浊带下，暑湿泻痢，衄血，尿血，肝热目赤，咽喉肿痛，痈肿疮毒。本方代茶温饮，不拘时常服。但脾肾虚寒者忌服。,经验方。,将前两味药洗净，制成粗末，放入杯中，加入白糖，用沸水冲泡片刻即成。,旱莲茶,679,内科-尿路感染
清热化湿，凉血解毒，利尿。,艾根茎45g，凤尾草、白茅根各15g，蜂蜜10g。,尿路感染，肾盂肾炎，膀胱炎等。,凤尾草，清热利湿、凉血止血、消肿解毒，治黄疸型肝炎、肠炎、菌痢、淋浊、带下、吐血、衄血、便血、尿血、扁桃体炎、腮腺炎、痈肿疮毒、湿疹。《生草药性备要》载其能“洗疳，疗痔，散毒，敷疮”。白茅根，凉血止血、清热利尿。治热病烦渴、吐血、衄血、肺热喘急、胃热啰逆、淋病、小便不利、水肿、黄疸。《神农本草经》谓其:“主劳伤虚羸，补中益气，除瘀血、血闭寒热，利小便。”四药合用，解毒利尿功能更胜。本方代茶温饮，每日2次，饭前饮用。注意:脾胃虚寒、溲多不渴者忌服。,经验方。,将前三味药洗净晒干后切细，共置于砂锅中，加水煎煮；后取汁，再加入适量蜂蜜即成。,利尿清茶,680,内科-尿路感染
滋肾，清热，利湿。,茵陈、生地各30g。,膀胱炎。,茵陈，清湿热、退黄疸。用于黄疸尿少，湿疮瘙痒，传染性黄疸型肝炎。生地，清热、凉血、生津。治温病伤阴，大热烦渴，舌绛，神昏，斑疹，吐血，衄血，虚劳骨蒸，咯血，消渴，便秘，血崩。《药性论》谓其:“解诸热，破血，通利月水闭绝，亦利水道，捣薄心腹，能消瘀血。患者虚而多热，加而用之。”本方代茶温饮，不拘时常服。脾胃有湿邪及阳虚者忌服。,经验方。,将上两药洗净晒干后切细，共置于砂锅中，加水煎煮后取汁即成。,茵地茶,681,内科-尿路感染
活血消炎，利水消肿。,绿茶1~2g，地菠萝(削皮挖去钉眼）250g。,泌尿系统疾病。,地菠萝，即菠萝。味甘、微酸，性微寒，有清热解暑、生津止渴、利小便的功效，可用于小便不利、伤暑、身热烦渴、腹中痞闷、消化不良、头昏眼花等病证。而且在其果汁中，还含有一种跟胃液相类似的酵素，可以分解蛋白质，帮助消化。美味的菠萝，不仅可以减月巴，而且对身体健康有着不同的功效。本方代茶频饮，每日1次，兼食其果。注意:糖尿病患者忌食，对菠萝过敏者忌食。,经验方。,先将地菠萝洗净，放入锅中，加水煮汤，再用其汤冲泡绿茶即成。用时饮茶食果。,绿茶地菠萝汤,682,内科-尿路感染
健脾胃，利水通淋。,绿茶0.5~1g，藤瓜60g（或用木瓜亦可）。,淋证，胃炎。,藤瓜清凉温润、清热祛湿，能加快废物的排除，清理肠道，并能起到修复胃肠壁黏膜的作用。对湿热下注出现尿频、尿急、尿痛等泌尿系感染有效，对上腹部不适、反酸等胃部不适症状也有效。本汤代茶温服，日服1剂，分3次饭后服。忌食辛辣和油腻食物。,经验方。,先将藤瓜洗净，放入锅中，加水煮汤，再用其汤冲泡绿茶即成。,绿茶藤瓜汤,683,内科-尿路感染
清热解毒，消炎止血，止泻。,绿茶0.5~1g，鲜车前草100~150g。,泌尿系统疾病。,车前草能清热解毒、消炎止血、止泻，对尿频、尿急、尿痛等泌尿系感染者有效。本方代茶温饮，不拘时常服。需注意的是，《本草汇言》云:“肾虚寒者尤宜忌之。”另外小便涩痛症重者可加海金沙20g，血尿重者可加白茅根50g，甘草5g，墨旱莲50g同煎服。,经验方。,先将车前草洗净，切细，放入锅中，加水煮汤，再用其汤冲泡绿茶即成。,绿茶车前草汤,684,内科-尿路感染
清热解毒，利水通淋。,海金沙60g，冰糖15g。,急性膀胱炎，肾盂肾炎等。,海金沙，李时珍称其为小肠、膀胱的血分药，《履巉岩本草》则称其能“治淋病热症者，并小便不利”。现代研究海金沙有利尿排石的作用，现代临床广泛用于泌尿系和消化道结石。本方代茶温饮，不拘时常服。肾阴虚者宜少服用。,经验方。,将海金沙洗净，用布包装好，放入锅中，加水煎汤，之后滤过取汁，加冰糖15g，调好后即成。,海金沙草茶,685,内科-尿路感染
清热利尿，平肝利胆。,黄瓜藤100g。,痢疾，淋病，黄水疮等。,黄瓜，也称胡瓜、青瓜，属葫芦科植物。广泛分布于中国各地，并且为主要的温室产品之一。黄瓜是由西汉时期张骞出使西域带回中原的，当时称为胡瓜，五胡十六国时后赵皇帝石勒忌讳“胡”字，汉臣襄国郡守樊坦将其改为“黄瓜”。黄瓜的茎上覆有毛，富含汁液，叶片的外观有3~5枚裂片，覆有绒毛。本方是流行于民间的验方。《四川中药志》谓其:“利水、通淋、消胀。”《上海常用中草药》谓其:“祛痰镇痉。”临床上多用于湿热淋证、胆囊炎的治疗。本方代茶温饮，不拘时常服。无湿热者慎用。,经验方。,将黄瓜藤洗净切碎，放入锅中，加水煎汤，之后滤过取汁即成。,黄瓜藤茶,686,内科-尿路感染
消炎利尿。,绿茶0.5~1.5g，六一散10~15g。,泌尿系统疾病，消渴。,六一散，治疗暑湿或湿温证属暑湿或湿热内蕴，症见身热汗出，口渴心烦，小便短赤或涩痛，或见呕吐泄泻，皮肤湿疹，痱子等。本方代茶温饮，不拘时常服。高血压、心脏病、肝病、糖尿病、肾病等慢性病严重者不宜服用。另外，尿痛者可加猪苓10~25g，肾阴不足，兼消渴者可加泽泻10~25g。,经验方。,将六一散与绿茶共置杯中，加沸水冲泡片刻即成。,绿茶六一汤,687,内科-尿路感染
清热凉血，利尿排毒。,绿茶1~2g，狗肝菜50~100g（鲜品），蜂蜜25g。,泌尿系统疾病。,狗肝菜有清热解毒、凉血、生津、利尿作用的功效，可用于治疗实热内结之热毒斑疹、便血、小便不利、肿毒疔疮等，外用可治跌打损伤，红肿出血。本方代茶温饮，不拘时常服。无火热者不可服用。另外，胆固醇高者，可去蜂蜜，加苹果切片100g；高血压头痛、心悸者可加桑椹20~30g；热病口渴、便秘者可加凉薯250g（去皮）；夜盲症者可去蜂蜜，加番茄200g，猪肝50g，换绿茶为红茶1g；血友病者可加花生仁、花生衣各15g。,经验方。,将狗肝菜洗净切细，放入砂锅中，加水煎汤，之后滤过取汁，冲泡绿茶，再加适量蜂蜜，调好后即成。,绿茶狗肝菜汤,688,内科-尿路感染
清热，凉血，利尿。,萹蓄草、马蔺根、黄芪、甘草各10~15g。,慢性肾盂肾炎。,萹蓄草，《滇南本草》谓其:“利小便。治五淋白浊，热淋，瘀精涩闭关窍，并治妇人气郁，胃中湿热，或白带之症。”马蔺根，《本草纲目》谓其:“主痈疽恶疮。”有清热解毒作用。黄芪有益气利水的作用。上药配伍应用，适用于湿热淋证，小便短赤，淋漓涩痛，或血淋等。本方代茶温饮，不拘时常服。无湿热者慎用。,经验方。,将上四味洗净，放入砂锅中，加水煮汤，之后再滤过取汁即成。,蓄蔺茶,689,内科-尿路感染
清湿热，利小便。,糠谷老30g。,尿道炎，小便不利，水肿等。,糠谷老即禾本科植物粟感染禾指梗霉而产生糠秕的稻穗。这是我国传统的茶方。《中华本草》:“糠谷老:清湿热，利小便。用于尿路感染，水肿，小便不利。清利湿热。主水肿，心烦，口渴，痢疾，湿疹，疮疖。”本方代茶温饮，不拘时常服。肾阳虚者不宜服用。,经验方。,将糠谷老洗净后，制成粗末，用沸水煎煮20分钟后取汁即成。,糠谷老茶,690,内科-尿路感染
清利湿热。,车前草100g，竹叶心、生甘草各10g，白糖适量。,湿热下注膀胱所致膀胱炎、尿道炎，小便短涩痛者。,本方中重用车前草为主药，其味甘性寒，归肝、肾、膀胱经，能清热利尿、凉血解毒。竹叶心味甘、苦，性凉，清心利尿，可引火（热）下行随小便而出。甘草入药历史悠久，早在2000多年前，《神农本草经》就将其列为药之上品。南朝医学家陶弘景将甘草尊为“国老”，并言:“此草最为众药之王，经方少有不用者。”李时珍在《本草纲目》中言:“诸药中甘草为君，治七十二种乳石毒，解一千二百草木毒，调和众药有功，故有‘国老'之号。”其味甘性平，有补脾益气、清热解毒、祛痰止咳、缓急止痛、调和诸药之功。本方代茶温饮，不拘时常服，可清利湿热。但本茶不宜久服。,经验方。,先将前三味洗净，切细，放入砂锅中，加适量水煎煮，之后再滤过取汁，调入适量白糖即成。,竹叶车前茶,691,内科-尿路感染
清热利尿，通淋。,通草、灯心草各3g，青茶叶6g，白茅根30g。,急性尿路感染，小便淋涩不通。,本方功能清热利尿、通淋，对急性尿路感染之轻症效果颇佳。方中通草味甘、淡，性凉，能清热利尿，是治热淋的常用药。灯心草味甘性寒，能清心降火、利尿通淋，《医学启源》中谓其:“通阴窍涩，利小水，除水肿，治五淋。”并能通利小肠热气，使之下行从小便而出。白茅根能清热利尿、凉血止血。再合清茶之清利，共奏清热利尿通淋之功。此方药性平和，且无异味，易为患者服，可日常代茶温饮，不拘时常服。,经验方。,上四味洗净切细，共置杯中，用适量沸水冲泡片刻即成。,通草茶,692,内科-尿路感染
清热利尿。,迎春花2g，车前草3g，绿茶3g。,小便热痛。,迎春花味苦、微辛，性平，能清热解毒、活血消肿。主治发热头痛、咽喉肿痛、小便热痛、恶疮肿毒、跌打损伤。迎春花因在百花之中开花最早，花后即迎来百花齐放的春天而得名，它与梅花、水仙和山茶花统称为“雪中四友”，是中国名贵花卉之一。车前草味甘，性寒，清热利尿、凉血解毒，主热结膀胱、小便不利、淋浊带下、暑湿泻痢、衄血、尿血、肝热目赤、咽喉肿痛、痈肿疮毒等。各味合用能清热利尿。注意，虚滑、精气不固者禁用。,经验方。,用开水冲泡后饮用。,迎春花茶,693,内科-尿路感染
清热生津，利尿。,鲜猕猴桃（去皮）2个，木通3g，绿茶3g，冰糖适量。,烦热，消渴，石淋等病证。,猕猴桃味酸、甘，性寒，有解热、止渴、通淋、健胃的功效。可以治疗烦热、消渴、黄疸、呕吐、腹泻、石淋、关节痛等疾病，而且还有抗衰老的作用。木通味苦，性寒，清热、利尿、通淋、清心火、通经下乳、利痹。合用能清热生津、利尿等。注意:脾虚便溏者、风寒感冒者、小儿腹泻者不宜食用，亦不可大量长时间服用。,经验方。,用猕猴桃、木通的煎煮液泡茶饮用。,猕猴桃木通茶,694,内科-尿路感染
利尿通淋。,萹蓄15~30g。,热淋，癃闭等病证。,《本草纲目》云萹蓄能治“热淋涩痛”。《滇南本草》则云其是“利小便，治五淋、白浊、热淋”的良药。现代临床上多用于泌尿系感染、前列腺肥大并结石、泌尿系结石的治疗。八正散中就有此药物。本方代茶温饮，不拘时常服，冲饮至味淡。注意:无下焦湿热者慎用。,经验方。,将萹蓄洗净后，制成粗末，放入杯中，用沸水冲泡片刻即成。,萹蓄茶,695,内科-尿路感染
清热利湿，通窍。,满天星20g。,尿闭。,满天星，为泥炭藓科植物细叶泥炭藓的全草，味淡微苦，性平，可以清热明目、退云翳、消肿。《祖国医学采风录》称，此方为我国民间茶方之一，有清热利湿、通窍的功效。据现代药理研究，此品对金黄色葡萄球菌、变形杆菌、痢疾杆菌、伤寒杆菌有一定的抑制作用，可治尿闭等病证。本方代茶温饮，不拘时常服，冲饮至味淡。注意:肾虚所致的尿闭不宜服用。,经验方。,将满天星洗净后，制成粗末，放入杯中，用沸水冲泡片刻即成。,满天星茶,696,内科-尿路感染
利尿排石。,石韦、车前草各60g，梔子30g，甘草15g。,肾盂肾炎，膀胱炎及尿道结石等。,石韦味苦、甘，性凉，入肺、膀胱经，有利水通淋、清肺泄热之功。《神农本草经》记载其:“主劳热邪气，五癃闭不通，利小便水道。”《本草别录》指出其:“止烦下气，通膀胱满，补五劳，安五藏，去恶风，益精气。”另外，梔子的果实是传统中药，入心、肝、肺、胃、三焦经，具有泻火除烦、清热利湿、凉血解毒、护肝、利胆、降压、镇静、止血、消肿等作用，属卫生部颁布的第1批药食两用资源。石韦、梔子加上车前草共奏清热利尿之功用，可利尿排石，治疗泌尿系统疾病等，饮用时加甘草调和药性。本方代茶温饮，不拘时常服。但该茶苦寒伤胃，脾虚便溏者不宜用。,《全国中草药汇编》。,上药洗净，共研成粗末，放入砂锅中，加水煎煮后，去渣取汁。,石韦茶,697,内科-尿路感染
清心安神。,灯心草5g，鲜竹叶30g。,癃闭，小儿心烦夜啼等。,灯心草、鲜竹叶，均入心经，味甘、淡，性寒。元末朱震亨言灯心草有“降心火、止血通气、散肿止渴”之功。《医学启源》谓其:“通阴窍涩，利小水，除水肿闭，治五淋。”《北方常用中草药手册》言其能“清热安神，利水通淋”。《西藏常用中草药》载其:“治心烦不寐。”竹叶，《本草正》载其有“退热烦躁不眠”之效。《药品化义》有“竹叶清香透心，微苦，凉气热气俱清”之言。本方代茶温饮，不拘时常服，冲饮至味淡。注意:下焦虚寒、小便不禁者禁服。,《常见病验方研究参考资料》。,将上两味洗净，制成粗末，放入砂锅，加水煎煮后去渣取汁即成。,灯心竹叶茶Ⅰ,698,内科-尿路感染
行瘀泻下，解痉止血。,绿茶0.5~1g，大黄3~5g，白糖25g。,心血管病。,大黄有“将军”之称，《神农本草经》称其:“味苦，寒。主下瘀血、血闭、寒热，破癥瘕积聚，留饮宿食。荡涤肠胃，推陈致新，通利水道，调中化食，安和五脏。”本品行瘀泻下、解痉止血，对心血管病有瘀血者有效。本方代茶温饮，不拘时服，冲饮至味淡。需注意的是，大黄苦寒，易伤胃气，脾胃虚弱者慎用；孕妇和经期、哺乳期妇女应忌用。,经验方。,先将喷上醋的大黄片微火稍炒，然后与绿茶、白糖同置一杯中，用沸水浸泡片刻即成。,绿茶大黄汤,649,内科-冠心病
消肉积，散瘀血，止痛，除腻消脂。,绿茶1~2g，山楂片25g。,心血管病。,山楂味酸、甘，性微温，入肝、脾、胃诸经，有消食积、化瘀滞之功。可助脾健胃，尤善消油腻肉食之积滞及小儿乳积。伤食一般炒焦用。《医学衷中参西录》谓之:“为其味酸而微甘，能补助胃中酸汁，故能消化饮食积聚，以治肉积尤效。”现代实验研究发现，山楂含黄酮化合物、多种三萜类化合物、柠檬酸、维生素C、脂肪酶等成分。食之可促进脂肪分解，使肉食易于消化。山楂还有促进胆固醇转化、降低血脂的功能。绿茶中的咖啡因有扩张心血管、增强毛细血管灌注的功能；其所含多酚类物质还有降低血脂和血糖的作用，并能防治胆固醇升高、动脉粥样硬化、心肌梗死等冠心病、高脂血症。两者合用，可增强消肉积、散瘀血、止痛、除腻消脂的效果。本方代茶温饮，不拘时服，冲饮至味淡。注意：中医认为“山楂只消不补”，故脾胃虚弱者不宜多食。儿童若长时间贪食山楂或山楂片、山楂糕等，对牙齿生长不利。食用后要注意及时漱口刷牙。此外，山楂有收缩子宫平滑肌的作用，孕妇不宜多吃，否则可能诱发流产。,经验方。,将山楂片与绿茶同置杯中，用沸水冲泡，加盖闷片刻即成。,绿茶山楂汤,650,内科-冠心病
