功效,组成,适应证,按语,方源,制作,药名,编号,分类
清肺止咳，理气化湿。,金石斛二钱、甘菊二钱、桑叶二钱、前胡一钱五分、酒黄芩一钱五分、陈皮一钱五分、神曲二钱、鲜青果七个（研）,感受外邪，郁而化热，或内有郁热，外感风寒，过食生冷，以致脾失健运，湿邪内生。出现咳嗽，痰黏稠量多，发热，微恶风寒，口淡无味，不思饮食等。,本方见于光绪皇帝医案。光绪某年二月三日，光绪皇帝“肺胃饮热，感受风寒，以致憎寒发热，偏右头疼，鼻塞身倦，口黏恶心”，御医庄守和予以疏风清热化湿调理。二月五日，“诸症见好，惟肺燥湿饮，稍有未清，以致喉中发咸，夜间微嗽”，御医庄守和予以清肺化湿代茶饮调理。方中菊花、桑叶、前胡疏风散热，宣肺解表，陈皮、石斛、神曲理气和胃化湿，黄芩、青果、前胡清肺止咳化痰。,清宫代茶饮,,清肺化湿代茶饮（一）,1316,止咳类代茶饮
清热化痰，宣肺止咳。,酒黄芩一钱五分、前胡二钱、桑皮二钱、川贝母二钱、天花粉二钱、紫菀一钱四分、桔梗二钱、鲜青果七个（研）,外感风寒，郁而化热，或风热束肺岀现咳嗽，痰黄稠，或兼发热、头痛、鼻塞。,本方见于光绪皇帝医案。二月五日光绪皇帝服上方“清肺化湿代茶饮”后，“夜卧尚有咳嗽”，御医庄守和诊其为“惟肺经饮热稍有未清”，予以清嗽化湿代茶饮调理。方中黄芩、桑皮、天花粉清泻肺热，贝母、紫菀、青果、前胡、桔梗宣肺化痰止咳，诸药合用共奏清肺止咳化痰之功。,清宫代茶饮,,清嗽化湿代茶饮,1317,止咳类代茶饮
清热止咳，理气化痰。,金石斛二钱、甘菊二钱、桑叶二钱、前胡一钱五分、酒黄芩一钱五分、陈皮一钱五分、炒神曲二钱、鲜青果七个（研）,肺胃湿热，咳嗽咯痰，喉中痒痛口渴不欲饮。,光绪某年二月初五日，光绪帝脉息左部和缓，右寸关滑而稍数，喉中发咸，夜间微嗽，证属肺中有热，湿饮内停，御医给此代茶饮调治。方中甘菊、桑叶、前胡、黄芩、鲜青果清肺散热止咳，陈皮理气去湿，神曲消导和胃，石斛清热养阴。清宫医案中清热化湿饮方中多配养阴药，盖宫廷之人，养尊处优，情志抑郁，素体多阴虚，再者，配以养阴又可助清邪热，防止热邪伤阴，是为清宫医案用药的一个重要特点。,清宫代茶饮,,清肺化湿代茶饮（二）,1318,止咳类代茶饮
清肺泻热，止咳化痰。,酒黄芩一钱五分、前胡二钱、桑皮二钱、紫菀一钱五分、天花粉二钱、川贝二钱、枳壳一钱五分、芦根一支（切碎）,肺胃有热，咳嗽咯痰，口干欲饮，咽喉疼痛等。,本方见于光绪皇帝医案。光绪某年二月初七日，光绪皇帝咳嗽、口渴，御医庄守和给予清嗽代茶饮调治。方中黄芩、桑皮、花粉、芦根清泻肺胃之热，生津止渴，前胡、紫菀、贝母理气化痰止咳，枳壳理气宽中。诸药合用，以清肺止咳，清胃生津。,清宫代茶饮,,清嗽代茶饮（一）,1319,止咳类代茶饮
清肺止咳，化湿蠲饮。,前胡一钱五分、酒芩一钱五分、桑皮二钱、法夏一钱五分、花粉二钱、桔梗一钱五分、云苓二钱、生草七分,脾虚痰湿内生，上犯于肺，肺失津肃，或外感风热，肺失肃降咳嗽、痰多、口渴、纳呆。,本方见于光绪皇帝医案。光绪某年二月初八日，光绪皇帝咳嗽四日，仍夜间咳嗽，御医庄守和诊其为“肺胃饮热未净，以致夜间咳嗽”，给予本代茶饮调治。方中黄芩、花粉、桑皮清解肺热，前胡、桔梗、甘草宣肺化痰止咳，半夏、茯苓健脾化湿，蠲化痰饮。诸药合用，共奏清肺止咳，蠲化痰饮之效。,清宫代茶饮,,清肺代茶饮（一）,1320,止咳类代茶饮
清肺止咳，和胃生津。,生地三钱、元参三钱、麦冬三钱、花粉三钱、前胡二钱、橘红一钱五分、桑叶二钱、竹茹二钱,肺胃燥热，咳嗽痰黏，口干欲饮，咽喉疼痛。,光绪某年十月十一日，光绪皇帝“头疼身痛，憎寒发热，口干作渴，胸满咳嗽”，经御医庄守和给予清肺止嗽，和胃化湿之法治疗后，至十月十四日“诸症见好，惟有咳嗽，口干作渴”，证为邪热伤津，余热未尽，庄守和予以本代茶饮调理。方中生地、玄参、麦冬、花粉清热生津止渴，桑叶、前胡、橘红清肺化痰止咳，竹茹和胃化痰，用药精当，方药切证。,清宫代茶饮,,清肺和胃代茶饮（一）,1321,止咳类代茶饮
清肺止咳，袪湿化痰。,前胡二钱、酒芩一钱五分、陈皮一钱五分、桑皮二钱、法夏二钱、茯苓二钱、甘草七分,肺胃痰热，咳嗽、咯痰，鼻塞不通，口渴咽干，纳呆等。,本方出于光绪皇帝医案。光绪某年正月二十日，光绪皇帝夜间微有咳嗽，脉左部和缓，右寸关滑而稍数。证为肺胃湿热未清，御医予本代茶饮调服。此方为二陈汤加黄芩、前胡、桑皮组成，方中二陈汤祛湿化痰，黄芩、前胡、桑皮清肺止咳。诸药合用，共奏清肺止咳，祛湿化痰之效。,清宫代茶饮,,清热化湿代茶饮（一）,1322,止咳类代茶饮
清热化痰，宣肺止咳。,瓜蒌皮二钱、川贝二钱、前胡一钱五分、酒芩一钱五分、蜜桑皮一钱五分、桔梗二钱、甘草七分,肺热咳嗽，咯痰黄黏，或兼有鼻塞、头痛、咽干咽痛之症。,光绪某年正月十九日，光绪皇帝外感风邪，经御医庄守和清解化湿饮调治后，至二十一日，“诸症俱减，惟肺经稍有饮热未净以致偶有咳嗽，鼻息欠爽”，庄守和予其“清肺理嗽代茶饮”调理。方中黄芩、桑皮清解肺经余热，瓜蒌皮、川贝母、前胡、桔梗理气化痰止咳，甘草调和诸药。诸药合用，以清肺化痰，理气止咳。,清宫代茶饮,,清肺理嗽代茶饮,1323,止咳类代茶饮
祛湿和胃，化痰止咳。,前胡八分、杏仁一钱五分、桔梗一钱、薄荷五分、陈皮六分、厚朴七分、竹茹一钱、甘草五分,痰湿内滞，外感风邪，引动伏痰，肺失清肃宣降，咳嗽，咯痰量多，或兼有肢倦纳呆，口干不渴等。,光绪某年十二月二十二日，光绪皇帝感受外邪，经用清肺化饮汤一剂治疗后，“表凉已解，症势渐好，惟饮热未净，肺气不清，以致咳嗽、鼻塞，口中干苦，食少不甜”。御医李德昌诊其脉息滑缓，证属饮热内滞，予以“清肺和胃饮”调治。方中陈皮、厚朴健脾化湿，理气祛痰，前胡、杏仁、桔梗、竹茹宣肺化痰止咳，薄荷、甘草清肺利咽。诸药合用，以奏理气化痰，宣肺止咳之效。,清宫代茶饮,,清肺和胃代茶饮（二）,1324,止咳类代茶饮
理气化痰，宣肺止咳。,茯苓三钱、陈皮六分、厚朴七分、杏仁一钱五分、桔梗一钱、炙甘草五分,痰湿阻肺，咳嗽咳痰量多，食少无味。,光绪某年十二月二十三日，光绪皇帝“有时鼻塞、咳嗽、食少、口黏”，证属痰浊阻肺，肺失肃降，御医李德昌给予“和胃清肺饮”调治。方中陈皮、厚朴理气祛湿化痰，茯苓运肺化湿，桔梗、杏仁、炙甘草宣肺止咳。诸药合用，健脾和胃，宣肺止咳。,清宫代茶饮,,和胃清肺饮,1325,止咳类代茶饮
理气化痰，肃肺止咳。,前胡二钱、苏梗子各八分、桔梗二钱、金沸草二钱、陈皮一钱、法半夏一钱五分、桑皮二钱、款冬花二钱,痰湿内蕴，肺失宣降而致咳嗽、痰多，口淡无味，肢倦食少。,光绪某年三月初四日，御医庄守和、李德昌诊得光绪皇帝脉“左关稍弦，右寸关见滑缓”，据其“有时咳嗽痰涎，鼻息稍欠清爽”，诊为“肺气欠和，湿饮未净”，予以“止嗽代茶饮”调理。方中前胡、桔梗、金沸草、苏梗子、桑皮、冬花宣肺化痰止咳，半夏、陈皮理气祛湿化痰。诸药合用，共奏健脾化痰，宣肺止咳之效。,清宫代茶饮,,止嗽代茶饮,1326,止咳类代茶饮
清热化痰，宣肺止咳。,前胡二钱、苏梗子各八分、枳壳一钱五分、橘红八分、法夏二钱、金沸草二钱、桑皮二钱、枇杷叶二钱,痰热郁肺，咳嗽，或兼面赤口干鼻塞不通。,光绪某年三月五日，光绪皇帝时有“咳嗽、痰涎，面赤作呛，鼻息气味不爽”等，御医庄守和、李德昌予以清嗽代茶饮调治。方中前胡、苏梗子、枇杷叶、桑皮、金沸草、橘红等清肺化痰止咳，枳壳、半夏理气除痰，诸药合用，共奏清肺止咳，理气化痰之效。,清宫代茶饮,,清嗽代茶饮（二）,1327,止咳类代茶饮
清肺散邪，化痰止咳。,菊花炭一钱五分、苦桔梗八分、陈皮七分、青竹茹一钱、杏仁二钱,肺中余热，咳嗽，咳痰，或痰中带血者。,光绪某年三月二十七日，光绪皇帝咳嗽咯血数日已止，御医薛福辰、庄守和、李德昌诊其脉右寸关略带浮滑，余俱平和，予以菊花竹茹代茶饮调理。方中菊花炭清热凉血止血，桔梗、陈皮、竹茹、杏仁清肺化痰止咳。诸药合用，共奏清肺散热，化痰止咳止血之效。,清宫代茶饮,,菊花竹茹代茶饮,1328,止咳类代茶饮
益气化痰，养血安神，清肺止咳。,西洋参三钱、生地四钱、当归四钱、杭芍四钱、大熟地六钱、杜仲三钱、龙骨三钱、莲蕊三钱、焦枣仁三钱、川芎一钱五分、川贝三钱、桑叶三钱、甘菊花三钱、苦梗三钱、橘红一钱五分、生草一钱,气血两亏，脾肾双虚，肺热咳嗽兼有神疲乏力，腰酸腿软，眠差食少，声低懒言等。,本方见于光绪某年五月十一日医案。光绪皇帝“偶然咳嗽，渐或有痰，言语气怯，中州较空，不耐凉热，手仍发胀，腰腿有时酸疼”，脉“左寸关浮滑力软，两尺仍弱”。御医杨际和认为病机“总缘气虚阴亏，脾肾不足，肝经易旺，致生浮火热”，故予以“参地苏橘代茶饮”治疗。方中西洋参补气健脾，当归、杭芍、生地、熟地、川芎养血滋肾，杜仲、龙骨补肾安神，枣仁、莲蕊清心安神，苏叶、枇杷叶、橘红清肺化痰止咳。诸药合用，以益气养血，滋补肝肾，清肺止咳，标本兼治。,清宫代茶饮,,参地苏橘代茶饮,1329,止咳类代茶饮
宣肺止咳，行气化痰。,苏梗子二钱、前胡一钱五分、金沸草一钱五分、枳壳一钱五分、广橘红一钱、壳砂八分,肺有痰饮，咳嗽咯痰，鼻塞不通。,本方见于光绪二十年珍嫔医案。四月二十七日，珍嫔咳嗽时作，眠食尚好，脉寸关滑缓，证属痰饮阻肺，气机失调。御医李德昌予以“清肺代茶饮”宣肺降气，止咳化痰。方中苏梗子、前胡、金沸草、橘红化痰理气止咳，枳壳、壳砂理气宣肺。诸药合用，共奏宣肺止咳之效。,清宫代茶饮,,清肺代茶饮（二）,1330,止咳类代茶饮
清热养阴解毒。,酒芩二钱、麦冬三钱、元参三钱、苦桔梗二钱、生甘草一钱,肺胃滞热，咽喉肿痛，胸满懒食。,道光二十七年三月二十五日，琳贵妃脉息浮数，面颊牙龈浮肿，咽喉疼痛，发热恶寒，肢节疼痛，夜不得寐。系肺胃蕴热、外感春温，风热郁结所致。经用疏解利咽方药调理，表凉已解，诸症俱减。二十七日琳贵妃惟稍觉咽喉肿痛，此乃肺之邪热未尽，故御医用此代茶饮调治。方中酒芩、苦桔梗清宣肺之余热，元参、麦冬、生甘草清热养阴，解毒利咽。诸药合用以奏清热养阴、解毒利咽之效。,清宫代茶饮,,清金代茶饮（三）,1331,清热类代茶饮-清热解毒代茶饮
清热透邪。,银花一钱五分、连翘一钱、生甘草五分,邪热客于肌肤、皮肤作痒。,道光二十七年四月二十一日，七阿哥喜痘十二朝，脉息和平、寝食如常，精神清爽。惟正气未复，皮肤尚有湿热，给予益气清化方药调治，诸症渐好，惟皮肤尚有余热。三十日御医给予银花、连翘、生甘草水煎代茶，清解肌肤热毒之邪，以善其后。,清宫代茶饮,,银花代茶饮,1332,清热类代茶饮-清热解毒代茶饮
清泻胃热。,酒芩三钱、酒连八分、梔子三钱、焦三仙六钱、次生地五钱、木通三钱、川军一钱五分,郁热滞胃，牙龈肿痛。,本方见于咸丰十一年十一月十一日吉嫔医案。据医案记载，吉嫔原系牙痛之证，经用清热化滞汤治疗后，牙龈肿痛渐轻，腮颊红肿亦渐消退，惟阳明郁热未尽，故御医用此代茶饮外吹牛黄冰苏散以清胃泻火、消肿止痛，方中酒芩、酒连、梔子清泻邪热，生地养阴凉血清热，木通清热利水，川军泻火通便，使邪有出路，用药配伍精当，切中病机。,清宫代茶饮,,清热代茶饮（一）,1333,清热类代茶饮-清热解毒代茶饮
清肝明目。,黄连一钱、梔子三钱、枯芩三钱、胆草二钱、菊花三钱、决明二钱,肝经郁热，目赤目痛。,同治四年四月二十六日，吉嫔脉息弦数。原系天行赤热之症，昨服清肝明目饮，翳膜渐平，诸症俱好，惟肝经郁热未尽，遂予本清热代茶饮调理。方中黄连、枯芩、梔子清泻三焦之热，胆草、菊花、决明清肝明目。诸药合用，共奏清肝泻热明目之效。,清宫代茶饮,,清热代茶饮（二）,1334,清热类代茶饮-清热解毒代茶饮
清热养阴利咽。,元参八钱、山豆根三钱、苦梗三钱、麦冬三钱、僵蚕三钱、青果六枚,瘟热毒滞，咽痛口干，便秘尿赤。,本方见于同治十三年十一月初一日戌刻同治皇帝医案。同日午刻，皇上脉息浮洪，天花二朝，瘟热毒滞过盛，头面颈项颗粒稠密，颜色紫滞，咽喉作痛，便秘尿赤，御医给予清解活命饮调理，缘其气血瘟毒过盛。戌刻继用此代茶饮，以助清解热毒，利咽止痛。方中元参、麦冬清热养阴，配山豆根、青果、苦梗以解毒利咽止痛，僵蚕散结消肿止痛，热毒壅滞于内，则须清之化之，汤药、代茶饮共进，冀其热毒速解也。,清宫代茶饮,,利咽代茶饮,1335,清热类代茶饮-清热解毒代茶饮
清泻阳明郁热。,麦冬三钱（去心）、桔梗二钱、银花三钱、知母二钱、豆根三钱、竹叶一钱五分,阳明郁热，口燥咽干，牙龈肿痛。,清宫医案载，同治八年二月二十三日大公主脉息浮滑，面颧发出疙瘩，成片作痒，系“肺胃湿热，血热受风之症”，御医给予疏风清热除湿方药治疗后，脉息滑缓、面部疙瘩俱好，惟肠胃余热未清，以致口燥咽干，牙龈微肿作痛。二月底予本代茶饮善后调理，以清肠胃余热。方中麦冬、知母清热护阴，银花、豆根清热解毒，散结止痛，桔梗清热引药上行，竹叶清热利尿，使邪热从小便而解。诸药合用共奏清解阳明郁热之效。,清宫代茶饮,,清热代茶饮（三）,1336,清热类代茶饮-清热解毒代茶饮
清热解毒利咽。,大青叶一钱五分、元参二钱、连翘二钱、薄荷一钱、干寸冬二钱、黄芩二钱、炒梔二钱、花粉一钱五分、鲜青果五个、炒杏仁八分、赤芍一钱五分,邪热内蕴，头闷肢倦，咽痛作嗽。,本方见于宣统十五年正月初六日宣统帝医案。据医案记载，宣统帝原系肝肺结热，外感风凉之证，以清热、理肺、利咽、和肝等法调理，邪热稍挫，风凉亦减，御医用此代茶饮继以清热，解毒，利咽。方中大青叶、连翘、黄芩、炒梔以清热解毒，薄荷、杏仁宣肺疏肝理气，麦冬养阴清热，青果、花粉清热生津利咽，赤芍清热凉血活营，诸药合用，共奏清热解毒利咽之效。,清宫代茶饮,,清热利咽代茶饮,1337,清热类代茶饮-清热解毒代茶饮
清解肺热，养阴生津。,桔梗三钱、天花粉三钱,肺热，咳嗽咽干。,本方见于乾隆四十七年三月初九日医案。十一福晋原系内有痰热，外感风寒之证，御医给予疏解、清热化痰药治疗后，表邪已解、脉息和缓，惟肺经余热未净，故止服汤药，而以桔梗、天花粉水煎代茶，以清解肺中余热。,清宫代茶饮,,清肺代茶饮（三）,1338,清热类代茶饮-清热养阴代茶饮
清宣肺热。,葛根一钱五分、麦冬一钱五分、桑皮一钱五分、藿香八分,肺热未清，发热恶风，咽干口渴。,道光某年九月二十五日，皇后脉息滑缓，系内热受凉，感冒之症，用清热和胃诸药调治后诸症俱好，惟肺之余热未净，故今用清肺代茶饮以善其后。方中桑皮、葛根、藿香清散肺之余热，麦冬养阴润肺。旨在清散余热后不伤其阴液。,清宫代茶饮,,清肺代茶饮（四）,1339,清热类代茶饮-清热养阴代茶饮
清热平肝。,豆根三钱、花粉三钱、麦冬三钱、小生地三钱、焦三仙六钱,肝热未清，胸胁胀满。,同治七年十二月十八日，祺妃肝经余热未尽、胸胁满闷，御医汪兆镛以平肝清热饮和舒肝养荣丸调,清宫代茶饮,,平肝清热饮,1340,清热类代茶饮-清热养阴代茶饮
清热益阴。,生地三钱、麦冬三钱（去心）、银花二钱、焦三仙六钱,阴分素亏，郁热内滞，咽喉疼痛。,本方见于同治七年十二月二十九日祺妃医案。据二十八日医案记载，祺妃原系胃经不和、饮热内滞之证，御医给以清热和胃饮调治，服药后脉息渐缓，诸症渐好。惟咽喉夜间作痛，此乃阴分素亏、热邪未尽所致，故以此代茶饮养阴清热以散余邪。方中生地、麦冬养阴清热，银花清热解毒，焦三仙消导和中，诸药合用共奏益阴清热利咽之功。,清宫代茶饮,,益阴代茶饮,1341,清热类代茶饮-清热养阴代茶饮
清热养阴。,石斛三钱、甘菊三钱、麦冬三钱、泽泻二钱、灯心五子,热滞肝胃，阴津不足，口干多饮，烦躁不宁。,此方见于同治八年三月十四日大公主医案。据医案记载，大公主原系肝胃邪热内炽，伤及血脉之证，经连服清热凉血之剂，血静热清，鼻衄痰红现已俱好，惟素来肝胃之火有余，汤药多服，恐伤胃气，故予清热代茶饮调理。方中石斛、麦冬养阴清胃，甘菊清肝平肝，泽泻、灯心清热利小便，使邪有出路。,清宫代茶饮,,清热代茶饮（四）,1342,清热类代茶饮-清热养阴代茶饮
清肝泻热。,焦三仙六钱、小生地三钱、麦冬三钱、竹茹二钱、白菊花二钱、甘草梢一钱,肝经郁火，发热口渴、小便短赤。,此方见于光绪四年八月初四日医案。据八月初一日医案记载“皇上脉息左关弦数、右寸关滑数。营卫未和、里滞尚盛”，发热、口渴，腹中有时作痛，小水短赤、大便尚有黏滞，证属火郁结滞所致。御医遂予清热化滞之药，循序调治，诸症见好，惟肝经余热未尽，故拟本代茶饮善后。方以白菊花、甘草梢清肝之余热，小生地、麦冬养阴护肝，竹茹、焦三仙清热消导和胃。诸药合用共奏清肝养阴之效，使热邪得清，胃气得复。,清宫代茶饮,,清热代茶饮（五）,1343,清热类代茶饮-清热养阴代茶饮
清热养阴祛湿。,元参一钱五分、麦冬三钱、竹茹二钱、苦梗一钱五分、橘皮一钱、生草五分,肠胃湿热，口渴口黏。,本方见于光绪十四年十一月十五日光绪帝医案。据医案记载:皇上原系肠胃蕴热、湿饮内滞之证。御医以清热化滞法调理，诸症见好，惟余热未尽，故以此代茶饮以善其后。方中元参、麦冬养阴清热，竹茹清热化湿和胃，苦梗、橘皮调理气机。据十六日医案记载，光绪皇帝诸症俱好，说明方药切中病机。,清宫代茶饮,,清热代茶饮（六）,1344,清热类代茶饮-清热养阴代茶饮
清热凉血，养阴解毒。,"玄参5 g,大青叶3 g,绿茶3 g。",乳蛾肿痛，感冒发热，腮腺炎。,"玄参味苦、甘、咸，能凉血滋阴、泻火解毒。大青叶为板 蓝根的叶子，味苦，性大寒，功用大致与板蓝根同，长于清瘟解毒，常 用于防治多种急性热性传染病,如流行性感冒（简称流感）、流行性脑 脊髓膜炎（简称流脑）、流行性乙型脑炎（简称乙脑）、腮腺炎及大叶性 肺炎和败血症等疾病。两药合用，能清热凉血、养阴解毒。注意:脾 胃虚寒者忌用。",经验方。,用300 ml开水冲泡后饮用。可加冰糖。,玄青茶,120,防疫辟邪
截疟。,水蜈蚣30 g。,疟疾。,"水蜈蚣，又名三荚草（《岭南采药录》），金钮子（《广州植 物志》），金钮草（《福建民间草药》），夜摩草（《广西药植图志》），寒气 草（《民间常用草药汇编》），十字草（《江西民间草药》），姜虫草、露水 草、水牛草、三步跳（《贵州民间药物》），散寒草、姜芽草、寒筋草（《四 川中药志》），水香附、燕含珠（《重庆草药》），发汗草（《中国药植图 鉴》），山蜈蚣、水乌梅、无头香附、龙吐珠（《泉州本草》）等。性温，味 辛，治感冒风寒、寒热头痛、筋骨疼痛、咳嗽、疟疾、黄疸、痢疾、疮疡肿 毒、跌打刀伤。《植物名实图考》称其“杀虫，败毒”。《福建民间草药》 谓其“解热利尿，治疟疾”。在疟疾发作前1~2小时,煎水代茶饮。继则每次20 g,沸水冲泡代茶饮。",经验方。,水蜈蚣，煎水代茶饮。,水蜈蚣茶,121,防疫辟邪
清热解暑利湿。,鸡蛋花3~9 g。,湿热下痢，中暑。,"《南宁市药物志》载鸡蛋花，性平味甘,无毒。《岭南采 药录》载其“治湿热下痢，里急后重，又能润肺解毒”。《南宁市药物 志》称其能“止咳”。",经验方。,"夏秋季采摘盛开的鸡蛋花花朵,晒干。放入杯中，用沸 水冲泡。",鸡蛋花茶,122,防疫辟邪
芳香化浊，健脾和胃。,"陈曲3 250 g,广藿香、苏叶、香附、苍术、广陈皮各 120 g,川朴、白芷、白蔻衣、法半夏、茯苓各60 g,砂仁45 g,桔梗、槟榔 各90 g,麦芽240 g,山楂180 g,甘草30 g,榆树叶粉425 g。",防治暑湿病。,"建曲，亦名范志曲、百草曲，是传统的中成药。《本草纲 目拾遗》载其“微苦香甘，搜风解表，调胃行痰,止嗽疟痢吐泻,能安瘟 疫瘴岚，散疹消斑，感冒头痛,食滞心烦”。每次10~20 g,沸水冲泡 代茶饮，尤宜于夏日远行时备用。注意:过敏体质者慎用。",经验方。,"将以上诸药干燥后混合碾细，再加榆树叶粉425 g,加 适量水调匀，制成曲块，每块30 g。",建曲茶,123,防疫辟邪
发汗祛风，清热解毒。,紫背浮萍干品5~10 g。,"温疫斑疹,风疹。",据《日华子本草》载，浮萍可“治热毒、风热疾、热狂、肿 毒、汤火疮、风疹”等。《玉楸药解》云其“治温疫斑疹”有效。浮萍有 疏风透疹的功效。风热所致的斑疹、风疹均可服用此茶。注意:不宜 用于风寒所致的风疹。,经验方。,沸水冲泡代茶频饮。,浮萍茶,124,防疫辟邪
疏风解表，清肝散热。,薄荷一钱、荆芥三钱、防风三钱、川芎一钱五分、白芷三钱、香附二钱（炙）、元参三钱、赤芍三钱、花粉三钱、橘红一钱五分、三仙三钱（焦研）,肝经郁热，外感风寒，头痛发热，口干口渴。,本方见于光绪皇帝某年二月二十七日医案。据医案记载，光绪帝原系肝经郁热，筋脉不舒，乳有筋核之证，御医给以清肝和脉诸方调治，症状好转，今又外感风寒，以致头痛微晕，身肢发热，鼻息气热，有时作渴，“脉左关弦浮而数，右寸关滑数”。证属风寒外束，肝经郁热，故御医以此代茶饮调治。方中薄荷、荆芥、防风、白芷疏风解表、散寒止痛，川芎、赤芍、香附、橘红疏肝理气、调和血脉，花粉、元参清热养阴止渴，三仙消导和中，诸药合用，共奏清肝泻热、疏风解表之效。据三月初二日医案记载，皇上诸症俱好，说明方药切证。,清宫代茶饮,,清解调肝代茶饮,1300,疏风解表类代茶饮-辛温解表代茶饮
,芥穗一钱五分、防风二钱、桑叶三钱、薄荷一钱、枳壳三钱、厚朴二钱、陈皮二钱、茅术二钱、云苓三钱、三仙六钱、木香八分、槟榔三钱（焦）,肺胃滞饮，感受风凉，胸膈懊憹，身肢困倦，头痛。,光绪某年二月二十日，御医白文寿诊得皇上脉息左关见弦，右寸浮数。乃肺胃素有饮热、复感受风邪，以致偏右头痛，胸膈懊憹，呕吐水饮。本代茶饮中荆芥穗、防风、桑叶、薄荷疏散表邪，茅术、云苓化湿祛饮，木香、陈皮、厚朴行气化滞，槟榔、三仙消积化饮。湿饮内滞，郁而化热，胸膈懊憹，用苦寒药清热祛湿有碍气机宣发，此方不用苦寒，而用辛温味苦之药祛湿化饮解表，湿饮去，气机条达，则郁热自消。,清宫代茶饮,,疏解代茶饮,1301,疏风解表类代茶饮-辛温解表代茶饮
