功效,组成,适应证,按语,方源,制作,药名,编号,分类
抗癌，凉血祛瘀，消肿止痛。,绿茶1~2g，赤芍9~15g，甘草5g。,白血病，脾气虚，胃癌腹痛等。,赤芍，《神农本草经》:“主邪气腹痛，除血痹，破坚积，寒热疝瘕，止痛，利小便，益气。”白血病、脾气虚者可加党参15g，大枣25g，黄芪15g；胃癌腹痛者可加白芍15~25g，香附25g，甘草5g改为10g。本茶日服1剂。无瘀血患者慎服。,经验方。,先将赤芍、甘草煎汤，然后泡茶温服。,绿茶赤芍汤,1281,肿瘤-白血病
收敛止血。,红茶1~2g，花生衣5~10g，大枣25g。,血证，如再生障碍性贫血和出血。,花生衣，止血、散瘀、消肿。用于血友病，类血友病，原发性及继发性血小板减少性紫癜，肝病出血，术后出血，癌肿出血，胃、肠、肺、子宫等出血。代茶饮，日服1剂，1月为1疗程。,经验方。,先将剖开的大枣和花生衣一起加水煎汤，然后泡茶饮。,红茶花生衣汤,1282,肿瘤-白血病
补血止血。,花生米（连衣）60~90g，大枣30~50g。,血小板减少性紫癜及各种出血后贫血，肿瘤患者经放疗、化疗后血小板及粒细胞减少。,方中主药花生衣为落花生的红色种皮，是近代发现的止血新药。最初发现口服花生米能缓解血友病患者的出血症状，后来知道，不仅对A型患者（缺乏Ⅷ因子）有效，而且对B型患者（缺乏IX因子）更有效，对某些其他出血疾病患者亦有止血作用，.但对严重岀血，其效果不佳。研究认为，花生衣能对抗纤维蛋白的溶解，能促进骨髓制造血小板，并改善血小板质量，缩短出血时间，加强毛细血管的收缩功能，改善凝血因子的缺陷等。对血小板减少性紫癜、血友病、先天性遗传性毛细血管扩张出血等不但有止血作用，而且对原发病亦有一定的治疗作用。大枣能养血、补益脾胃，可增强机体对血液的生成和固摄能力。红糖为补中活血之品。方中三物同用，共收养血补虚、收敛止血之效。每日1剂，连服10~15日。凡有湿痰、积滞、齿病、虫病者，均不宜饮用此茶。,《实用食疗方精选》。,先将花生米在温水中浸泡半小时，取皮，晒干备用。大枣洗净后温水泡开去核，酌加清水煎煮半小时后拣去花生衣，加适量红糖，分次饮汁并吃枣。,花生衣红枣茶,1283,肿瘤-白血病
清热解毒，消肿止痛。,泡过的茶叶。,外伤，烫伤。,此茶能清热解毒，消肿止痛。如有外伤、烫伤，不论已溃未溃，搽之即愈。,《四科简效方》。,将泡过的茶叶用坛盛正朝北地上，用砖盖好，愈陈愈好。,烫伤茶,1284,骨折外伤
破血行瘀，润燥滑肠。,桃仁5g，花茶3g。,瘀血肿痛，跌打损伤，风痹肿痛。,桃仁活血祛瘀、润肠通便、止咳平喘，用于闭经、痛经、癥瘕痞块、跌仆损伤、肠燥便秘。《本草经疏》:“夫血者阴也，有形者也，周流夫一身者也，一有凝滞则为癥瘕，瘀血血闭，或妇人月水不通，或击扑损伤积血，及心下宿血坚痛，皆从足厥阴受病，以其为藏血之脏也。桃仁苦能泄滞，辛能散结，甘温通行而缓肝，故主如上诸证也。心下宿血去则气自下，咳逆自止。味苦而辛，故又能杀小虫也。桃仁性善破血，散而不收，泻而无补，过用之，及用之不得其当，能使血下不止，损伤真阴。”孕妇忌服。,经验方。,桃仁7—9月摘收。用桃仁的煎煮液150ml泡茶饮用。,桃仁茶,1285,骨折外伤
散寒通经，舒筋活络。,乌药3g，威灵仙1g，花茶3g。,跌打损伤，背部伤尤宜。,乌药味辛，性温，归肺、脾、肾、膀胱经。乌药辛开温散，善于疏通气机，能行气止痛、温肾散寒，用于寒郁气滞所致的胁痛、脘腹胀、寒疝腹痛及痛经等。威灵仙性善走，能通经络、祛风湿、消痰水，止痛作用强。本品辛散走窜，久服易伤正气，气血虚弱，无风寒湿邪者慎服。,经验方。,乌药全年可采挖。威灵仙秋季采挖。用200ml开水泡饮，冲饮至味淡。,乌威茶,1286,骨折外伤
散瘀止血，消肿定痛。,三七5g，花茶3g。,跌打损伤瘀血肿块，吐血，咳血，衄血，便血，崩漏，癥瘕，产后血晕、恶露不下，心绞痛，小肠炎症。,三七化瘀止血、活血定痛，用于人体各种出血病证及跌打损伤、瘀滞肿痛。明代著名的药学家李时珍称其为“金不换”。三七是中药材中的一颗明珠，清代药学著作《本草纲目拾遗》中记载：“人参补气第一，三七补血第一，味同而功亦等，故称人参三七，为中药中之最珍贵者。”扬名中外的中成药“云南白药”和“片仔癀”，即以三七为主要原料制成。现代医学研究表明，三七能扩张血管，降低血压，改善微循环，增加血流量，预防和治疗心脑组织缺血、缺氧，促进蛋白质、核糖核酸（RNA）、脱氧核糖核酸（DNA）合成，强身健体；双向调节中枢神经，提高脑力，增强学习和记忆能力；增强机体免疫功能，抗肿瘤；保肝、抗炎；延缓衰老；双向调节血糖，降低血脂、胆固醇，抑制动脉硬化等。适宜于心脑血管疾病患者，高血压、高脂血症及贫血人群，各类血证患者，体质虚弱、免疫力低下人群，妇女经期前后，生活节奏快的白领人士，应酬多、经常饮酒的人士。但孕妇和儿童禁用本茶。,经验方。,采收栽培3年以上的植株。8月上旬立秋前后采挖的春三七，质较好。冬季11月采挖的为冬三七，质较差。用三七的煎煮液250ml泡茶饮用，冲饮至味淡。,三七茶,1287,骨折外伤
活血通经，祛瘀止痛；降血压。,红花3g，花茶3g。,瘀血作痛，跌打损伤皮下充血肿胀，产后恶露不尽，闭经，冠心病。,红花入心、肝血分，秉辛散温通之性，能活血祛瘀、通调经脉。用于痛经、血滞经闭、产后瘀阻腹痛、跌打损伤瘀痛、关节疼痛等。现代医学研究表明，红花有轻度兴奋心脏、降低冠脉阻力、增加冠脉流量和心肌营养性血流量的作用，能延长血栓形成时间。广泛应用于临床各科多种瘀血阻滞为患或血行不畅之证。孕妇忌用。,经验方。,红花夏季开花，花色由黄转为鲜红时采摘。用150ml开水冲泡后饮用，冲饮至味淡。,红花茶,1288,骨折外伤
消肿止痛。,红茶3g，月季花6g，红糖30g。,跌打损伤，血瘀肿痛。,红茶有清热解毒的功效，现代药理研究发现红茶中的多酚类化合物具有消炎的效果，再经由实验发现，儿茶素类能与单细胞的细菌结合，使细菌蛋白质凝固沉淀，借此抑制和消灭病原菌。所以细菌性痢疾及食物中毒患者喝红茶颇有益，民间也常用浓茶涂伤口、褥疮和外用治足癣。月季味甘、性温，入肝经，有活血调经、消肿解毒之功效。红糖甘甜，温润，无毒，有补血、破瘀的作用。此茶对于跌打外伤有很好疗效，每日1剂，分3次饭后温服。糖尿病患者忌服。,经验方。,三味加水300ml，煮沸5分钟，晾温。,月季红糖茶,1289,骨折外伤
活血调经，祛风止痛。,杜鹃花2g，白芷3g，绿茶3g。,跌打瘀肿，外伤出血，皮肤疥疮，肿毒等。,杜鹃花又叫映山红，味苦、涩，性凉，功能祛瘀消肿、解毒、止血。主治跌打瘀肿、外伤出血、皮肤疥疮、肿毒。本品多外用，取新鲜根、叶适量，捣敷，或煎水外洗。内服要注意，黄色杜鹃的植株和花内均含有毒素，误食后会引起中毒；白色杜鹃的花中含有四环二萜类毒素，中毒后会引起呕吐、呼吸困难、四肢麻木等。映山红素有“木本花卉之王”的美称，古今中外的文人墨客创作了许多赞诵映山红的诗文。如宋代杨万里的一首“何须名苑看春风，一路山花不负侬。日日锦江呈锦样，清溪倒照映山红。”颂扬了映山红质朴、顽强的生命力。,经验方。,用开水冲泡后饮用。,杜鹃花茶,1290,骨折外伤
解毒，疗疮治痿。,细茶叶适量。,毛虫螫伤发作，坚硬如肉痘，蜂螫伤，蜈蚣咬伤。,绿茶具有解毒、疗疮治痿的功效。《本草纲目》记载绿茶治“痘疮作痒，房中宜烧茶烟恒熏之”。将所取的茶汁洗搽患处，每日数次，连续数日，以愈为度。,经验方。,沸水冲泡取汁。,细茶叶,1291,骨折外伤
排毒消肿。,桃茎白皮30g，茶叶适量。,被狂犬咬伤初期，咬伤部位有隐痛感。,桃茎白皮为蔷薇科植物桃或山桃去掉栓皮的树皮。其味苦，性平，无毒，有杀诸疮虫的作用。被狂犬咬伤初期者宜常饮此茶。,经验方。,将桃茎白皮和茶叶用水煎。,桃茎白茶,1292,骨折外伤
清热解毒，疏风行气，活血止痛。,东风菜根300g，浓茶汁100g。,蛇咬伤应急辅助治疗。,东风菜根味辛，性温，有疏风、行气、活血、止痛的功效。主治骨节疼痛，跌打损伤，且能治疗毒蛇咬伤。将冲好的浓茶服下，再将药渣敷伤口周围，每日1次。,经验方。,将东风菜根洗净，捣取原汁，冲入浓茶。,蛇咬伤茶,1293,骨折外伤
消肿止痛，防止感染。,茶叶适量。,外伤，肿痛。,绿茶有清热解毒、消肿止痛的功用。此茶使用方法为将烫伤肢体浸于茶汁中，或将浓茶汁涂于烫伤部位。,经验方。,茶叶加水煮成浓汁，快速冷却。,伤浓茶剂,1294,骨折外伤
止血，化瘀。,杨梅鲜根适量，茶油适量。,烧伤，烫伤。,杨梅鲜根，味辛，性温，有理气、止血、化瘀的功效，能治疗外伤出血、跌打损伤、烫火伤等。茶油为野山茶果提炼而成的食用油。相传元末，朱元璋被陈友谅军队追杀到建昌（今属江西）的一片油茶林，正在油茶林中采摘的老农见此状况，急中生智，把朱元璋装扮成采摘油茶果的农夫，幸免一劫。朱元璋亲切地称老农为救命“老表”。老表见朱元璋遍体是伤，用茶油帮他涂上。不几天朱元璋就觉得身上的伤口愈合，红肿渐消，于是他高兴地称此油茶果是“上天赐给大地的人间奇果”。后来他在老表家休养一段时间，便秘又有好转，得知这是每天吃茶油的缘故。从此。朱元璋与茶油结下了不解之缘。朱元璋统一天下后，将江西茶油封为“皇宫御膳用油”。茶油能治疗烧烫伤、破皮、刀伤，涂即止疼，不去皮，不起水疱。如有外伤、烫伤，将此茶涂患处，每日数次，连续数日，以愈为度。,经验方。,前味炒至焦黑存性，研细末，加茶油和匀。,杨梅鲜根茶油方,1295,骨折外伤
清热解毒，止血消肿。,桃树皮、茶油适量。,烫火伤。,桃树皮味苦，性平，无毒，有清热解毒的功效。桃树皮炒炭存性，不仅能清热解毒，还能止血。每用此药，将桃树皮烧炭末调茶油敷患处。,经验方。,桃树皮烧炭存性，研末。,桃树皮茶油方,1296,骨折外伤
止血消炎。,干茶渣适量。,外伤出血。,绿茶有清热解毒、消炎消肿的功用，茶渣焙过更有止血的功效。使用时将茶渣撒敷伤口上即可。,经验方。,将干茶渣焙至微黄。,干茶渣,1297,骨折外伤
清热燥湿，解毒杀虫。,绿茶25g，苦参150g，明矾50g。,伤口化脓性感染。,苦参味苦，性寒，有清热燥湿、祛风杀虫的功效，可治疗湿毒疮疡等。明矾性寒味酸涩，具有较强的收敛作用，中医认为明矾具有解毒杀虫、燥湿止痒、止血止泻、清热消痰的功效。现代研究表明，明矾还有抗菌作用。明矾末与前两味加水1500ml，煮沸15分钟，温洗患处。洗后药液可留用，再煮15分钟后再洗，日用1剂。,经验方。,明矾研末备用。,苦参明矾茶,1298,骨折外伤
化痰软坚，祛瘀通经。,芭蕉花2g，川贝母2g，花茶3g。,热病，痈肿热毒，烫伤等。,芭蕉花及叶味甘淡，性寒。芭蕉叶预防瘟疫已有几千年的历史。现代药理研究表明，芭蕉叶是一种广谱抗菌抗病毒的药物，对多种病毒和细菌都有抑制和杀灭作用，对呼吸系统疾病有一定的防治作用。其功能清热、利尿、解毒。可治热病、中暑、脚气、痈肿热毒、烫伤等。川贝母味苦、甘，性微寒，清热润肺、化痰止咳。两药合用后能化痰软坚，祛瘀通经。,经验方。,用川贝母的煎煮液泡芭蕉花、花茶饮用。,芭蕉花茶,1299,骨折外伤
强心利尿。,万年青根30g，茶叶6g。,心源性水肿。,万年青根，能强心利尿、清热解毒、止血，治心力衰竭、咽喉肿痛、白喉、水肿、臌胀、咯血、吐血、疔疮、丹毒、蛇咬、烫伤。王安卿《采药志》：“治中满蛊胀，黄疸，心疼，哮喘咳嗽，跌打伤。”煎水代茶饮。因该品有小毒，饮用时应注意副作用，如恶心、呕吐等。,经验方。,上两味煎水代茶。,万年青根茶,894,内科-水肿
利尿降压。,向日葵花30g，麦秸30g。,肾炎水肿。,向日葵花，菊科植物向日葵的花蕾。《民间常用草药汇编》记载其:“祛风，明目。治头昏，面肿，又可催生。”麦秸，大麦成熟后枯黄的茎秆，消肿、利湿、理气。孕妇忌服。,经验方。,向日葵花，秋季采收。上两味制成粗末，沸水冲泡或煎水代茶饮。,向日葵花茶Ⅰ,895,内科-水肿
祛风明目。,向日葵花2g，菊花3g，绿茶3g。,风热目病。,向日葵花又称春菊、马兰头花，味微甘，性平，含槲皮黄苷、三萜皂苷、向日葵皂苷A、向日葵皂苷B、向日葵皂苷C等成分，有扩张血管、降低血压、退热等作用，中医认为其能祛风平肝、明目利湿，主要用于头晕、耳鸣、小便淋漓，又可催生。煎汤，15~30g。加入菊花，味辛、甘、苦，性微寒，散风清热、平肝明目。两药合用能祛风明目。注意:孕妇忌服。,经验方。,用开水冲泡后饮用。可加糖。,向日葵花茶Ⅱ,896,内科-水肿
利尿退腹水。,鲤鱼1条，红茶20g。,肝炎腹水。,鲤鱼味甘，性平，具有滋补健胃、利水消肿、通乳、清热解毒作用，对各种水肿、腹胀、少尿、黄疸、乳汁不通皆有益。《本草纲目》曰：“鲤，其功长于利小便，故能消肿胀、黄疸、脚气、喘嗽、湿热之病，煮食下水气，利小便。”方中红茶助鲤鱼利尿退腹水之效。鲤鱼忌与绿豆、芋头、牛羊油、猪肝、鸡肉、荆芥、甘草、南瓜、狗肉等同食，也忌与中药中的朱砂同服。,经验方。,上两味同煮汤，不加盐食用。,鲤鱼茶,897,内科-水肿
益气健脾，利水消胀。,松萝茶9g，好黑矾1.5g，活黑鱼1尾（约350g），蒜瓣适量。,气臌，水臌。,《中药大辞典》载曰：“松萝茶产地徽州，功用：消积、滞油腻，消火，下气，降痰。”《本草纲目》谓黑矾:“消积滞，燥脾湿，化痰涎，除胀满黄肿、疟利、风眼、口齿诸病。”黑鱼是乌鳢的俗称，黑鱼中含脂肪、18种氨基酸等，适于身体虚弱，低蛋白血症，脾胃气虚，营养不良，贫血者食用。黑鱼有祛风治疳、补脾益气、利水消肿之效。大蒜行气消积、杀虫解毒，还可作为调味品。四药合用可益气健脾、利水消胀。注意:黑矾有毒，用之小心。,经验方。,将黑鱼去鳞，破肚去肠，加入黑矾、茶。男用蒜8瓣，女用蒜7瓣，共入鱼腹内，放锅中蒸熟。让患者吃鱼，能连茶、蒜吃更佳。,松萝黑鱼茶,898,内科-水肿
益气行水，祛湿强筋。,五加皮5g，黄芪3g，花茶3g。,心源性水肿，肾性水肿，关节肿胀疼痛。,黄芪的药用历史迄今已有2000多年了，始见于汉墓马王堆出土的帛书《五十二病方》，《神农本草经》将其列为上品。明代《本草纲目》记载：“耆，长也，黄芪色黄，为补者之长，故名……”《本草汇言》记载：“黄芪，补肺健脾，卫实敛汗，驱风运毒之药也……”《本草逢原》记载：“黄芪能补五脏诸虚，治脉弦自汗，泻阴火，去肺热，无汗则发，有汗则止。”黄芪补气利尿退肿，适用于气虚失运、水湿停聚引起的肢体面目水肿、小便不利等。黄芪能补脾肺之气，为补气要药，且有升举阳气的作用。五加皮味辛、苦，性温，归肝、肾经。能利水消肿，治水肿。本茶代茶频饮，不拘时温服，冲饮至味淡。注意:方中黄芪补气升阳，易于助火，又能止汗，故凡表实邪盛、气滞湿阻、食积内停、阴虚阳亢、痈疽初起或溃后热毒尚盛等，均不宜用。,经验方。,将上三味药共同洗净切细，放入壶中，以沸水浸泡片刻即可。,五加苗茶,899,内科-水肿
清热利湿，柔肝散结。,鲜李子100~150g，绿茶2g，蜂蜜25g。,肝硬化，腹水等。,方中李子性平，味甘、酸，入肝、肾经。可清肝涤热、生津、利水。主治消渴、腹水。《医林纂要》中提到李子“养肝，泻肝，破瘀”。蜂蜜补中、润燥、止痛、解毒。而绿茶不仅具有提神清心、清热解暑、消食化痰、去腻减肥、清心除烦、解毒醒酒、生津止渴、降火明目、止痢除湿等药理作用，并且对现代高血压等心血管疾病、高脂血症、癌症也有一定的药理功效。三者合用，可增强清热、利湿之效。每日1剂，分早、中、晚3次服用。,《饮茶的科学》。,将鲜李子剖开后置锅内，加水320ml，煮沸3分钟，再加茶叶与蜂蜜，沸后起锅取汁即可。,李子茶,900,内科-水肿
行气消肿。,白术15g，枳实45g。,气臌水肿，较适宜肝硬化腹水、晚期血吸虫病臌胀等。,李杲曰：“枳实消胀，苦以泄之也；白术去湿，苦以燥之也。后张元素治痞用枳术丸，亦从此汤化出。此乃水饮所作，则用汤以荡涤之；彼属食积所伤，则用丸以消磨之。一汤一丸，各有深意，非漫无主张也。”可见枳实、白术是中医临床中常用的一个药对，其中枳实破气，白术味苦、甘，性温，归脾、胃经，可健脾益气、燥湿利水。二者配伍可行气利水。无论是单独应用还是与他药组方使用，均可行气消肿，多用于脾胃疾病，相当于现代医学的消化系统疾病。每日1剂，不拘时饮服。气虚者慎用。,《中医交流验方汇编》。,上两味加水煎汤，代茶饮用。,白术枳实茶,901,内科-水肿
大补元气，生津。,人参3g，甘草3g，花茶3g。,脾胃气虚，精神欠佳，伤神耗气，暑热伤津耗气。,人参大补元气、补脾益肺、生津止渴，用于脾气不足和气虚欲脱。人参能益气生津止渴，适用于热病气津两伤，身热而渴，汗多，脉大无力等。同时人参大补元气，凡失血、吐泻及一切疾病因元气虚脱出现体虚之证，人参均可挽救虚脱。甘草补脾益气、润肺止咳，用于脾胃虚弱，中气不足，气短乏力，食少便溏。与人参相伍，更能益气健脾。本茶含人参，实证、热证而正气不虚忌服。人参反藜芦，畏五灵脂，恶皂荚。甘草反大戟、芫花、海藻。久服较大剂量甘草，易引起水肿，使用时应注意。,经验方。,人参秋季茎叶将枯萎时采挖。甘草春秋采挖。用200ml开水冲泡后饮用，冲泡至味淡。,参甘茶,1268,肿瘤-食道癌
补气益阴。,黄芪5g，山药5g，花茶3g。,脾胃气弱诸症，糖尿病，慢性肠炎，慢性胃及十二指肠溃疡。,黄芪味甘性微温，归脾、肺经，能补气升阳、益卫固表、托毒生肌、利水退肿。用于治疗气虚乏力，中气下陷，久泻脱肛，便血崩漏，表虚自汗，痈疽难溃，久溃不敛，血虚萎黄，内热消渴，慢性肾炎，蛋白尿，糖尿病等。炙黄芪益气补中，生用固表托疮。现代医学研究表明，黄芪含皂苷、蔗糖、多糖、多种氨基酸、叶酸及硒、锌、铜等多种微量元素，有增强机体免疫功能、保肝、利尿、抗衰老、抗应激、降压和较广泛的抗菌作用。能消除实验性肾炎蛋白尿，增强心肌收缩力，调节血糖含量。黄芪不仅能扩张冠状动脉，改善心肌供血，提高免疫功能，而且能够延缓细胞衰老的进程。山药益气养阴、补脾肺肾。既补脾气，又益脾阴，且兼涩性，能止泻，同时能补肾固涩。本茶补气升阳，易于助火，又能止汗，故凡表实邪盛、气滞湿阻、食积内停、阴虚阳亢、痈疽初起或溃后热毒尚盛等证，均不宜用。,经验方。,黄芪春秋两季采挖。以上三味用250ml开水冲泡后饮用，冲饮至味淡。,黄芪山药茶,1269,肿瘤-食道癌
健脾，抗癌。,红茶1~3g，猕猴桃50?100g，大枣25g。,最适用于胃癌及维生素C缺乏症。,猕猴桃，调中理气、.生津润燥、解热除烦。可生食，或去皮后和蜂蜜煎汤服。用于消化不良，食欲不振，呕吐，烧烫伤。可用本品绞汁，加生姜汁服。红茶猕猴桃汤，可温饮，日服1剂。猕猴桃的维生素C含量较高，不能和牛奶同时食用。由乙型肝炎演变为肝癌者可加鲜田基黄60g；患喉癌，声嘶，口干者可加鲜草莓60g，去红茶，改用绿茶2g。早在公元前成书的《诗经》中就有了猕猴桃的记载。李时珍在《本草纲目》中描绘猕猴桃的形、色时说:“其形如梨，其色如桃，而猕猴喜食，故有诸名。”唐慎微在《证类本草》上说它:“味甘酸，生山谷，藤生着树，叶圆有毛，其果形似鸭鹅卵大，其皮褐色，经霜始甘美可食。”这种酸中泛甜，芳香怡人，营养丰富的果实，竟被埋没了几千年，人类真正了解和利用它也不过百余年的历史，长期以来一直是猴子的“仙果”美食。煎汤服用。猕猴桃性寒，脾胃虚弱者不宜久服。,经验方。,先将猕猴桃、大枣煎汤，然后加红茶再煮。,红茶猕猴桃汤,1270,肿瘤-食道癌
抗癌，健脾燥湿。,用绿茶1~3g，白术9~15g，甘草3g。,癌症，脾虚食少，腹胀泄泻等。,消化不良者可去绿茶改为红茶，生甘草改为炙甘草，另加生姜5g；气虚自汗者可加黄芪15g，浮小麦25g；水肿者可加姜皮、茯苓皮各5~10g。白术，《神农本草经》记载:“气味甘温，无毒，治风寒湿痹、死肌、痉、疸，止汗、除热、消食。”阴虚燥渴、气滞胀闷者忌服。,经验方。,白术、甘草煎汤后泡茶温服。,绿茶白术汤,1271,肿瘤-食道癌
抗癌，健脾胃，利尿消肿。,绿茶1~2g，茯苓5~10g，蜂蜜25g。,癌症，脾胃虚弱所致的水肿等。,古人称茯苓为“四时神药”，因为它功效非常广泛，不分四季，将它与各种药物配伍，不管寒、温、风、湿诸疾，都能发挥其独特功效。茯苓味甘、淡，性平，入药具有利水渗湿、益脾和胃、宁心安神之功用。现代医学研究证实茯苓能增强机体免疫功能，茯苓多糖有明显的抗肿瘤及保肝脏作用。本茶日服1剂。阴虚而无湿热、虚寒滑精、气虚下陷者慎服。,经验方。,先将茯苓研末后煎汤，边煮边搅，免其结底，待煮沸后，加入绿茶、蜂蜜泡饮。,绿茶茯苓汤,1272,肿瘤-食道癌
抗癌，清热解毒。,绿茶3g，甘草10g，白花蛇舌草100g（或鲜品250g）。,癌症，咽喉肿痛，肠痈，疖肿疮疡，毒蛇咬伤等。,白花蛇舌草为全草类药用植物，具有清热解毒、利尿消肿、活血止痛等功效，近年医学研究又证实其具有抗癌、清热解毒等功效。本茶不宜用于阳虚寒盛患者。,经验方。,先将甘草、白花蛇舌草用水浸透，然后用文火煎汤，冲茶饮服。,绿茶白花蛇舌草汤,1273,肿瘤-食道癌
抗癌，利尿消肿。,绿茶1~2g，猪苓10~25g，甘草5g。,癌症，小便不利，水肿等。,《本草求真》载:“猪苓，凡四苓、五苓等方，并皆用此，性虽有类泽泻，同入膀胱肾经，解热除湿，行窍利水，然水消则脾必燥，水尽则气必走。”猪苓利水渗湿，治小便不利、水肿、泄泻、淋浊、带下。它不仅具有利尿和抗菌作用，经研究发现还有抗癌作用。日服1剂。不宜久服，久服必损肾气。,经验方。,先将猪苓捣碎，与甘草加水煮沸，再加绿茶冲泡饮服。,绿茶猪苓汤,1274,肿瘤-膀胱癌
清热解毒，利湿通淋。,用绿茶1~3g，石韦5~15g，冰糖25g。,癌症，肾炎，泌尿系感染，水肿，慢性气管炎等。,石韦，《本草纲目》载其“主崩漏，金疮，清肺气”，有镇咳、祛痰、平喘、利水通淋、清肺泄热的作用。阴虚及无湿热者忌服。,经验方。,先用水将石韦煮沸，然后加绿茶和冰糖再煮沸，需温服。,绿茶石韦汤,1275,肿瘤-膀胱癌
